{
  "schema_version": "1.1.0",
  "construction_digest": "e7a28724a8a543f6788ab42cf9929bd8b7fcd2b17e7639f03fa136070a3f11ca",
  "document_type": "top8_comparison_bases",
  "source": "mtgo",
  "format": "pauper",
  "classifier_digest": "751aeebfc17301e63bbeb51a4beedd94a97ed4f2de48078ece11e062b98c1d0a",
  "week": {
    "start": "2026-09-28",
    "end": "2026-10-04"
  },
  "base_period": "4w",
  "base_period_end": "2026-10-04",
  "identities": {
    "azorius-affinity": {
      "identity_id": "azorius-affinity",
      "display_name": "Azorius Affinity",
      "base_status": "unavailable",
      "average_deck": {
        "sample_size": 0,
        "medoid": null,
        "core": [],
        "flex": [],
        "recent_change": null,
        "recent_change_reason": "nobase"
      }
    },
    "battle-screech/mono-white": {
      "identity_id": "battle-screech/mono-white",
      "display_name": "Mono-White Battle Screech",
      "base_status": "available",
      "average_deck": {
        "sample_size": 20,
        "medoid": {
          "player": "M_EMORIE_S",
          "event_id": "12854488",
          "event_name": "Pauper Challenge 32",
          "final_rank": 6,
          "swiss_score": 15,
          "player_count": 52,
          "starttime": "2026-09-17 19:00:00.0",
          "main_deck": [
            {
              "name": "Battle Screech",
              "qty": 4
            },
            {
              "name": "Elite Interceptor",
              "qty": 1
            },
            {
              "name": "Guardians' Pledge",
              "qty": 2
            },
            {
              "name": "Idyllic Grange",
              "qty": 2
            },
            {
              "name": "Journey to Nowhere",
              "qty": 1
            },
            {
              "name": "Kor Skyfisher",
              "qty": 4
            },
            {
              "name": "Leonardo, Big Brother",
              "qty": 3
            },
            {
              "name": "Lunarch Veteran",
              "qty": 4
            },
            {
              "name": "Militia Bugler",
              "qty": 3
            },
            {
              "name": "Novice Inspector",
              "qty": 4
            },
            {
              "name": "Plains",
              "qty": 17
            },
            {
              "name": "Prismatic Strands",
              "qty": 3
            },
            {
              "name": "Raffine's Informant",
              "qty": 4
            },
            {
              "name": "Thraben Charm",
              "qty": 4
            },
            {
              "name": "Thraben Inspector",
              "qty": 4
            }
          ],
          "side_deck": [
            {
              "name": "Dust to Dust",
              "qty": 4
            },
            {
              "name": "Hallow",
              "qty": 2
            },
            {
              "name": "Holy Light",
              "qty": 2
            },
            {
              "name": "Journey to Nowhere",
              "qty": 3
            },
            {
              "name": "Martyr of Sands",
              "qty": 3
            },
            {
              "name": "Palace Sentinels",
              "qty": 1
            }
          ]
        },
        "core": [
          {
            "name": "Plains",
            "mean_qty": 16.6,
            "rate": 1.0
          },
          {
            "name": "Novice Inspector",
            "mean_qty": 4.0,
            "rate": 1.0
          },
          {
            "name": "Raffine's Informant",
            "mean_qty": 4.0,
            "rate": 1.0
          },
          {
            "name": "Battle Screech",
            "mean_qty": 3.9,
            "rate": 1.0
          },
          {
            "name": "Thraben Inspector",
            "mean_qty": 3.9,
            "rate": 1.0
          },
          {
            "name": "Lunarch Veteran",
            "mean_qty": 3.6,
            "rate": 1.0
          },
          {
            "name": "Kor Skyfisher",
            "mean_qty": 3.4,
            "rate": 0.85
          },
          {
            "name": "Leonardo, Big Brother",
            "mean_qty": 3.4,
            "rate": 1.0
          },
          {
            "name": "Thraben Charm",
            "mean_qty": 3.3,
            "rate": 0.85
          },
          {
            "name": "Prismatic Strands",
            "mean_qty": 3.1,
            "rate": 0.85
          },
          {
            "name": "Guardians' Pledge",
            "mean_qty": 2.1,
            "rate": 1.0
          }
        ],
        "flex": [
          {
            "name": "Idyllic Grange",
            "mean_qty": 1.6,
            "rate": 0.75
          },
          {
            "name": "Ramosian Rally",
            "mean_qty": 1.0,
            "rate": 0.65
          },
          {
            "name": "Elite Interceptor",
            "mean_qty": 0.8,
            "rate": 0.45
          },
          {
            "name": "Fortress Kin-Guard",
            "mean_qty": 0.6,
            "rate": 0.15
          },
          {
            "name": "Salt Road Packbeast",
            "mean_qty": 0.6,
            "rate": 0.15
          },
          {
            "name": "Search Party Captain",
            "mean_qty": 0.6,
            "rate": 0.15
          },
          {
            "name": "Militia Bugler",
            "mean_qty": 0.5,
            "rate": 0.15
          },
          {
            "name": "Spider-Man, Web-Slinger",
            "mean_qty": 0.5,
            "rate": 0.45
          },
          {
            "name": "Martyr's Soul",
            "mean_qty": 0.4,
            "rate": 0.1
          },
          {
            "name": "Hinterland Sanctifier",
            "mean_qty": 0.3,
            "rate": 0.1
          },
          {
            "name": "Journey to Nowhere",
            "mean_qty": 0.3,
            "rate": 0.25
          },
          {
            "name": "Patient Instructor",
            "mean_qty": 0.3,
            "rate": 0.15
          },
          {
            "name": "Ancient Den",
            "mean_qty": 0.2,
            "rate": 0.05
          },
          {
            "name": "Darksteel Citadel",
            "mean_qty": 0.2,
            "rate": 0.05
          },
          {
            "name": "Dispatch",
            "mean_qty": 0.2,
            "rate": 0.05
          },
          {
            "name": "Summon: Choco/Mog",
            "mean_qty": 0.2,
            "rate": 0.1
          },
          {
            "name": "Whitemane Lion",
            "mean_qty": 0.2,
            "rate": 0.15
          },
          {
            "name": "Eagles of the North",
            "mean_qty": 0.1,
            "rate": 0.15
          },
          {
            "name": "Triplicate Spirits",
            "mean_qty": 0.1,
            "rate": 0.05
          }
        ],
        "recent_change": 21,
        "recent_change_reason": null
      }
    },
    "bogles": {
      "identity_id": "bogles",
      "display_name": "Bogles",
      "base_status": "available",
      "average_deck": {
        "sample_size": 53,
        "medoid": {
          "player": "John1111",
          "event_id": "12854501",
          "event_name": "Pauper Challenge 16",
          "final_rank": 14,
          "swiss_score": 6,
          "player_count": 28,
          "starttime": "2026-09-19 09:00:00.0",
          "main_deck": [
            {
              "name": "Abundant Growth",
              "qty": 4
            },
            {
              "name": "Ancestral Mask",
              "qty": 4
            },
            {
              "name": "Armadillo Cloak",
              "qty": 4
            },
            {
              "name": "Ash Barrens",
              "qty": 2
            },
            {
              "name": "Cartouche of Solidarity",
              "qty": 1
            },
            {
              "name": "Ethereal Armor",
              "qty": 4
            },
            {
              "name": "Forest",
              "qty": 12
            },
            {
              "name": "Gladecover Scout",
              "qty": 4
            },
            {
              "name": "Kruphix's Insight",
              "qty": 1
            },
            {
              "name": "Lifelink",
              "qty": 1
            },
            {
              "name": "Malevolent Rumble",
              "qty": 4
            },
            {
              "name": "Plains",
              "qty": 3
            },
            {
              "name": "Rancor",
              "qty": 4
            },
            {
              "name": "Sentinel's Eyes",
              "qty": 1
            },
            {
              "name": "Silhana Ledgewalker",
              "qty": 3
            },
            {
              "name": "Slippery Bogle",
              "qty": 4
            },
            {
              "name": "Utopia Sprawl",
              "qty": 4
            }
          ],
          "side_deck": [
            {
              "name": "Flaring Pain",
              "qty": 2
            },
            {
              "name": "Mask of Law and Grace",
              "qty": 3
            },
            {
              "name": "Ram Through",
              "qty": 2
            },
            {
              "name": "Scattershot Archer",
              "qty": 3
            },
            {
              "name": "Spirit Link",
              "qty": 3
            },
            {
              "name": "Standard Bearer",
              "qty": 2
            }
          ]
        },
        "core": [
          {
            "name": "Forest",
            "mean_qty": 11.9,
            "rate": 1.0
          },
          {
            "name": "Abundant Growth",
            "mean_qty": 4.0,
            "rate": 1.0
          },
          {
            "name": "Ancestral Mask",
            "mean_qty": 4.0,
            "rate": 1.0
          },